{
  "generated_at": "2026-10-17T11:10:38.099354+00:00",
  "schema_version": "1.1.0",
  "totals": {
    "documents": 110574,
    "chunks": 373612,
    "tickers": 2435
  },
  "by_source": {
    "10-K": {
      "documents": 1561,
      "tickers": 799,
      "chunks": 49925
    },
    "10-Q": {
      "documents": 5797,
      "tickers": 908,
      "chunks": 188384
    },
    "13F": {
      "documents": 108,
      "tickers": 108,
      "chunks": 108
    },
    "20-F": {
      "documents": 13,
      "tickers": 7,
      "chunks": 764
    },
    "40-F": {
      "documents": 4,
      "tickers": 2,
      "chunks": 26
    },
    "8-K": {
      "documents": 11826,
      "tickers": 919,
      "chunks": 42767
    },
    "news": {
      "documents": 90259,
      "tickers": 2429,
      "chunks": 90259
    },
    "thesis_news": {
      "documents": 221,
      "tickers": 63,
      "chunks": 429
    },
    "thesis_research": {
      "documents": 221,
      "tickers": 63,
      "chunks": 386
    },
    "thesis_score": {
      "documents": 132,
      "tickers": 63,
      "chunks": 132
    },
    "thesis_signal": {
      "documents": 432,
      "tickers": 122,
      "chunks": 432
    }
  },
  "by_ticker_coverage": {
    "tickers_with_any_doc": 2435,
    "p25_docs_per_ticker": 1,
    "p50_docs_per_ticker": 5,
    "p75_docs_per_ticker": 34
  },
  "embedding": {
    "model": "voyage-3-lite",
    "dimension": 512
  },
  "ingestion": {
    "last_run_ts": "2026-10-17T11:05:09.563645+00:00",
    "by_source_last_ts": {
      "10-K": "2026-10-17T10:58:32.279722+00:00",
      "10-Q": "2026-10-16T13:54:25.352708+00:00",
      "13F": "2026-10-17T11:05:09.563645+00:00",
      "20-F": "2026-10-10T15:27:37.989218+00:00",
      "40-F": "2026-09-25T23:32:18.335590+00:00",
      "8-K": "2026-10-17T10:59:54.730279+00:00",
      "news": "2026-10-16T11:27:44.421103+00:00",
      "thesis_news": "2026-03-31T17:51:46.445317+00:00",
      "thesis_research": "2026-03-31T17:51:48.547672+00:00",
      "thesis_score": "2026-03-31T17:57:51.654055+00:00",
      "thesis_signal": "2026-07-18T19:08:51.828606+00:00"
    },
    "by_date_source": [
      {
        "date": "2026-10-17",
        "doc_type": "10-K",
        "documents": 1,
        "chunks": 81
      },
      {
        "date": "2026-10-17",
        "doc_type": "13F",
        "documents": 3,
        "chunks": 3
      },
      {
        "date": "2026-10-17",
        "doc_type": "8-K",
        "documents": 5,
        "chunks": 23
      },
      {
        "date": "2026-10-16",
        "doc_type": "10-Q",
        "documents": 2,
        "chunks": 56
      },
      {
        "date": "2026-10-16",
        "doc_type": "13F",
        "documents": 2,
        "chunks": 2
      },
      {
        "date": "2026-10-16",
        "doc_type": "8-K",
        "documents": 11,
        "chunks": 45
      },
      {
        "date": "2026-10-16",
        "doc_type": "news",
        "documents": 1492,
        "chunks": 1492
      },
      {
        "date": "2026-10-15",
        "doc_type": "news",
        "documents": 1331,
        "chunks": 1331
      },
      {
        "date": "2026-10-14",
        "doc_type": "news",
        "documents": 1188,
        "chunks": 1188
      },
      {
        "date": "2026-10-13",
        "doc_type": "news",
        "documents": 1466,
        "chunks": 1466
      },
      {
        "date": "2026-10-12",
        "doc_type": "news",
        "documents": 551,
        "chunks": 551
      },
      {
        "date": "2026-10-11",
        "doc_type": "news",
        "documents": 324,
        "chunks": 324
      },
      {
        "date": "2026-10-10",
        "doc_type": "10-K",
        "documents": 7,
        "chunks": 557
      },
      {
        "date": "2026-10-10",
        "doc_type": "10-Q",
        "documents": 6,
        "chunks": 182
      },
      {
        "date": "2026-10-10",
        "doc_type": "13F",
        "documents": 13,
        "chunks": 13
      },
      {
        "date": "2026-10-10",
        "doc_type": "20-F",
        "documents": 1,
        "chunks": 88
      },
      {
        "date": "2026-10-10",
        "doc_type": "8-K",
        "documents": 25,
        "chunks": 88
      },
      {
        "date": "2026-10-10",
        "doc_type": "news",
        "documents": 928,
        "chunks": 928
      },
      {
        "date": "2026-10-09",
        "doc_type": "news",
        "documents": 986,
        "chunks": 986
      },
      {
        "date": "2026-10-08",
        "doc_type": "news",
        "documents": 1186,
        "chunks": 1186
      },
      {
        "date": "2026-10-07",
        "doc_type": "news",
        "documents": 1121,
        "chunks": 1121
      },
      {
        "date": "2026-10-06",
        "doc_type": "news",
        "documents": 891,
        "chunks": 891
      },
      {
        "date": "2026-10-05",
        "doc_type": "news",
        "documents": 467,
        "chunks": 467
      },
      {
        "date": "2026-10-04",
        "doc_type": "news",
        "documents": 227,
        "chunks": 227
      },
      {
        "date": "2026-10-03",
        "doc_type": "13F",
        "documents": 2,
        "chunks": 2
      },
      {
        "date": "2026-10-03",
        "doc_type": "8-K",
        "documents": 13,
        "chunks": 55
      },
      {
        "date": "2026-10-03",
        "doc_type": "news",
        "documents": 746,
        "chunks": 746
      },
      {
        "date": "2026-10-02",
        "doc_type": "news",
        "documents": 1274,
        "chunks": 1274
      },
      {
        "date": "2026-10-01",
        "doc_type": "news",
        "documents": 1335,
        "chunks": 1335
      },
      {
        "date": "2026-09-30",
        "doc_type": "news",
        "documents": 1155,
        "chunks": 1155
      },
      {
        "date": "2026-09-29",
        "doc_type": "news",
        "documents": 990,
        "chunks": 990
      },
      {
        "date": "2026-09-28",
        "doc_type": "news",
        "documents": 629,
        "chunks": 629
      },
      {
        "date": "2026-09-27",
        "doc_type": "news",
        "documents": 347,
        "chunks": 347
      },
      {
        "date": "2026-09-26",
        "doc_type": "news",
        "documents": 578,
        "chunks": 578
      },
      {
        "date": "2026-09-25",
        "doc_type": "10-K",
        "documents": 28,
        "chunks": 2294
      },
      {
        "date": "2026-09-25",
        "doc_type": "10-Q",
        "documents": 5,
        "chunks": 147
      },
      {
        "date": "2026-09-25",
        "doc_type": "20-F",
        "documents": 12,
        "chunks": 676
      },
      {
        "date": "2026-09-25",
        "doc_type": "40-F",
        "documents": 4,
        "chunks": 26
      },
      {
        "date": "2026-09-25",
        "doc_type": "8-K",
        "documents": 5,
        "chunks": 15
      },
      {
        "date": "2026-09-25",
        "doc_type": "news",
        "documents": 1133,
        "chunks": 1133
      },
      {
        "date": "2026-09-24",
        "doc_type": "10-K",
        "documents": 2,
        "chunks": 168
      },
      {
        "date": "2026-09-24",
        "doc_type": "10-Q",
        "documents": 9,
        "chunks": 156
      },
      {
        "date": "2026-09-24",
        "doc_type": "13F",
        "documents": 9,
        "chunks": 9
      },
      {
        "date": "2026-09-24",
        "doc_type": "8-K",
        "documents": 17,
        "chunks": 82
      },
      {
        "date": "2026-09-24",
        "doc_type": "news",
        "documents": 1139,
        "chunks": 1139
      },
      {
        "date": "2026-09-23",
        "doc_type": "news",
        "documents": 1256,
        "chunks": 1256
      },
      {
        "date": "2026-09-22",
        "doc_type": "news",
        "documents": 1199,
        "chunks": 1199
      },
      {
        "date": "2026-09-21",
        "doc_type": "news",
        "documents": 618,
        "chunks": 618
      },
      {
        "date": "2026-09-20",
        "doc_type": "news",
        "documents": 261,
        "chunks": 261
      },
      {
        "date": "2026-09-19",
        "doc_type": "10-K",
        "documents": 1,
        "chunks": 40
      },
      {
        "date": "2026-09-19",
        "doc_type": "10-Q",
        "documents": 3,
        "chunks": 66
      },
      {
        "date": "2026-09-19",
        "doc_type": "13F",
        "documents": 79,
        "chunks": 79
      },
      {
        "date": "2026-09-19",
        "doc_type": "8-K",
        "documents": 27,
        "chunks": 99
      },
      {
        "date": "2026-09-19",
        "doc_type": "news",
        "documents": 762,
        "chunks": 762
      },
      {
        "date": "2026-09-18",
        "doc_type": "news",
        "documents": 826,
        "chunks": 826
      },
      {
        "date": "2026-09-17",
        "doc_type": "news",
        "documents": 812,
        "chunks": 812
      },
      {
        "date": "2026-09-16",
        "doc_type": "news",
        "documents": 951,
        "chunks": 951
      },
      {
        "date": "2026-09-15",
        "doc_type": "news",
        "documents": 1121,
        "chunks": 1121
      },
      {
        "date": "2026-09-14",
        "doc_type": "news",
        "documents": 434,
        "chunks": 434
      },
      {
        "date": "2026-09-13",
        "doc_type": "news",
        "documents": 263,
        "chunks": 263
      },
      {
        "date": "2026-09-12",
        "doc_type": "10-K",
        "documents": 1,
        "chunks": 29
      },
      {
        "date": "2026-09-12",
        "doc_type": "10-Q",
        "documents": 8,
        "chunks": 232
      },
      {
        "date": "2026-09-12",
        "doc_type": "8-K",
        "documents": 28,
        "chunks": 116
      },
      {
        "date": "2026-09-12",
        "doc_type": "news",
        "documents": 635,
        "chunks": 635
      },
      {
        "date": "2026-09-11",